{
  "schemaVersion": "phase12.phase11-graph-review-extension.v1",
  "graphAsNavigationOnlyChecked": true,
  "unsafeIndexingChecked": true,
  "staleGraphChecked": true,
  "sourceReadRequired": true,
  "wikiVreAuthorityPreserved": true,
  "checkedGraphRunRefs": [],
  "checkedWikiRefs": [],
  "checkedSourceRefs": [],
  "staleGraphMetadataRefs": []
}
